{
  "schemaVersion": 1,
  "projectId": "silent-orbit-skills-library",
  "generatedAt": "2026-07-25T12:00:00.000Z",
  "privacy": "sanitized",
  "sources": [
    {
      "id": "source:local-global:8ff0a25c41eb",
      "providerKind": "local",
      "label": "global",
      "scanState": "complete",
      "capabilities": {
        "discovery": "read-only",
        "write": false,
        "updateChannel": "unknown"
      }
    },
    {
      "id": "source:local-obsidian:c5a1f73808be",
      "providerKind": "local",
      "label": "obsidian",
      "scanState": "complete",
      "capabilities": {
        "discovery": "read-only",
        "write": false,
        "updateChannel": "unknown"
      }
    },
    {
      "id": "source:personal-deck:d3713fdc6fa4",
      "providerKind": "personal",
      "label": "个人常用",
      "scanState": "complete",
      "capabilities": {
        "discovery": "read-only",
        "write": false,
        "updateChannel": "unknown"
      }
    },
    {
      "id": "source:plugin-browser:9dc68a9de2eb",
      "providerKind": "plugin",
      "label": "Plugin: browser",
      "scanState": "complete",
      "capabilities": {
        "discovery": "read-only",
        "write": false,
        "updateChannel": "external"
      }
    },
    {
      "id": "source:plugin-build-web-apps:5042ebc6b7a7",
      "providerKind": "plugin",
      "label": "Plugin: build-web-apps",
      "scanState": "complete",
      "capabilities": {
        "discovery": "read-only",
        "write": false,
        "updateChannel": "external"
      }
    },
    {
      "id": "source:plugin-canva:a75129678c0b",
      "providerKind": "plugin",
      "label": "Plugin: canva",
      "scanState": "complete",
      "capabilities": {
        "discovery": "read-only",
        "write": false,
        "updateChannel": "external"
      }
    },
    {
      "id": "source:plugin-chrome:788145d0e076",
      "providerKind": "plugin",
      "label": "Plugin: chrome",
      "scanState": "complete",
      "capabilities": {
        "discovery": "read-only",
        "write": false,
        "updateChannel": "external"
      }
    },
    {
      "id": "source:plugin-computer-use:3cbd72eba62f",
      "providerKind": "plugin",
      "label": "Plugin: computer-use",
      "scanState": "complete",
      "capabilities": {
        "discovery": "read-only",
        "write": false,
        "updateChannel": "external"
      }
    },
    {
      "id": "source:plugin-creative-production:7f7639b98cb3",
      "providerKind": "plugin",
      "label": "Plugin: creative-production",
      "scanState": "complete",
      "capabilities": {
        "discovery": "read-only",
        "write": false,
        "updateChannel": "external"
      }
    },
    {
      "id": "source:plugin-data-analytics:7d3761ef00d2",
      "providerKind": "plugin",
      "label": "Plugin: data-analytics",
      "scanState": "complete",
      "capabilities": {
        "discovery": "read-only",
        "write": false,
        "updateChannel": "external"
      }
    },
    {
      "id": "source:plugin-documents:0261af28325c",
      "providerKind": "plugin",
      "label": "Plugin: documents",
      "scanState": "complete",
      "capabilities": {
        "discovery": "read-only",
        "write": false,
        "updateChannel": "external"
      }
    },
    {
      "id": "source:plugin-figma:55cc7d7c35a3",
      "providerKind": "plugin",
      "label": "Plugin: figma",
      "scanState": "complete",
      "capabilities": {
        "discovery": "read-only",
        "write": false,
        "updateChannel": "external"
      }
    },
    {
      "id": "source:plugin-github:82b7f245fc6a",
      "providerKind": "plugin",
      "label": "Plugin: github",
      "scanState": "complete",
      "capabilities": {
        "discovery": "read-only",
        "write": false,
        "updateChannel": "external"
      }
    },
    {
      "id": "source:plugin-gmail:ef11e9f30cde",
      "providerKind": "plugin",
      "label": "Plugin: gmail",
      "scanState": "complete",
      "capabilities": {
        "discovery": "read-only",
        "write": false,
        "updateChannel": "external"
      }
    },
    {
      "id": "source:plugin-google-drive:cfc2839588d1",
      "providerKind": "plugin",
      "label": "Plugin: google-drive",
      "scanState": "complete",
      "capabilities": {
        "discovery": "read-only",
        "write": false,
        "updateChannel": "external"
      }
    },
    {
      "id": "source:plugin-hyperframes:f69c9b1984d4",
      "providerKind": "plugin",
      "label": "Plugin: hyperframes",
      "scanState": "complete",
      "capabilities": {
        "discovery": "read-only",
        "write": false,
        "updateChannel": "external"
      }
    },
    {
      "id": "source:plugin-netlify:6e07a7bc4494",
      "providerKind": "plugin",
      "label": "Plugin: netlify",
      "scanState": "complete",
      "capabilities": {
        "discovery": "read-only",
        "write": false,
        "updateChannel": "external"
      }
    },
    {
      "id": "source:plugin-notion:d1e78bf528eb",
      "providerKind": "plugin",
      "label": "Plugin: notion",
      "scanState": "complete",
      "capabilities": {
        "discovery": "read-only",
        "write": false,
        "updateChannel": "external"
      }
    },
    {
      "id": "source:plugin-openai-developers:f480cdd8710b",
      "providerKind": "plugin",
      "label": "Plugin: openai-developers",
      "scanState": "complete",
      "capabilities": {
        "discovery": "read-only",
        "write": false,
        "updateChannel": "external"
      }
    },
    {
      "id": "source:plugin-presentations:a6374b381c28",
      "providerKind": "plugin",
      "label": "Plugin: presentations",
      "scanState": "complete",
      "capabilities": {
        "discovery": "read-only",
        "write": false,
        "updateChannel": "external"
      }
    },
    {
      "id": "source:plugin-product-design:b6157c15e53e",
      "providerKind": "plugin",
      "label": "Plugin: product-design",
      "scanState": "complete",
      "capabilities": {
        "discovery": "read-only",
        "write": false,
        "updateChannel": "external"
      }
    },
    {
      "id": "source:plugin-sales:848756b8cfff",
      "providerKind": "plugin",
      "label": "Plugin: sales",
      "scanState": "complete",
      "capabilities": {
        "discovery": "read-only",
        "write": false,
        "updateChannel": "external"
      }
    },
    {
      "id": "source:plugin-spreadsheets:675f3970551e",
      "providerKind": "plugin",
      "label": "Plugin: spreadsheets",
      "scanState": "complete",
      "capabilities": {
        "discovery": "read-only",
        "write": false,
        "updateChannel": "external"
      }
    },
    {
      "id": "source:plugin-template-creator:d09c2f817d32",
      "providerKind": "plugin",
      "label": "Plugin: template-creator",
      "scanState": "complete",
      "capabilities": {
        "discovery": "read-only",
        "write": false,
        "updateChannel": "external"
      }
    },
    {
      "id": "source:repo-lewislulu-html-ppt-skill:34a15c9afa0c",
      "providerKind": "repo",
      "label": "lewislulu/html-ppt-skill",
      "sourceUrl": "https://github.com/lewislulu/html-ppt-skill",
      "scanState": "complete",
      "capabilities": {
        "discovery": "read-only",
        "write": false,
        "updateChannel": "source-managed"
      }
    },
    {
      "id": "source:repo-mzlogin-chinese-copywriting-gui:3fb232cc1d86",
      "providerKind": "repo",
      "label": "mzlogin/chinese-copywriting-guidelines",
      "sourceUrl": "https://github.com/mzlogin/chinese-copywriting-guidelines",
      "scanState": "complete",
      "capabilities": {
        "discovery": "read-only",
        "write": false,
        "updateChannel": "source-managed"
      }
    },
    {
      "id": "source:repo-openai-skills:25cd9d697332",
      "providerKind": "repo",
      "label": "openai/skills",
      "sourceUrl": "https://github.com/openai/skills",
      "scanState": "complete",
      "capabilities": {
        "discovery": "read-only",
        "write": false,
        "updateChannel": "source-managed"
      }
    },
    {
      "id": "source:system-codex-system:593ad5f111af",
      "providerKind": "system",
      "label": "Codex System Skills",
      "scanState": "complete",
      "capabilities": {
        "discovery": "read-only",
        "write": false,
        "updateChannel": "system-managed"
      }
    }
  ],
  "items": [
    {
      "id": "skill:local-global-agent-reach:51ae965bb722",
      "kind": "skill",
      "name": "agent-reach",
      "sourceId": "source:local-global:8ff0a25c41eb",
      "state": "present",
      "origin": "third-party",
      "visibility": "public"
    },
    {
      "id": "skill:local-global-beautify-github-readme:0b1f04b33544",
      "kind": "skill",
      "name": "beautify-github-readme",
      "sourceId": "source:local-global:8ff0a25c41eb",
      "state": "present",
      "origin": "third-party",
      "visibility": "public"
    },
    {
      "id": "skill:local-global-hatch-pet:da19f0e6adb0",
      "kind": "skill",
      "name": "hatch-pet",
      "sourceId": "source:local-global:8ff0a25c41eb",
      "state": "present",
      "origin": "unknown",
      "visibility": "public"
    },
    {
      "id": "skill:local-global-html-diagram:81297ab5bab1",
      "kind": "skill",
      "name": "html-diagram",
      "sourceId": "source:local-global:8ff0a25c41eb",
      "state": "present",
      "origin": "third-party",
      "visibility": "public"
    },
    {
      "id": "skill:local-global-html-plan:6db21ad99df8",
      "kind": "skill",
      "name": "html-plan",
      "sourceId": "source:local-global:8ff0a25c41eb",
      "state": "present",
      "origin": "third-party",
      "visibility": "public"
    },
    {
      "id": "skill:local-global-html:a9710aa195ef",
      "kind": "skill",